{
  "schemaVersion": 1,
  "id": "valheim",
  "name": "Valheim",
  "connector": "valheim",
  "platforms": ["linux"],
  "sources": {
    "steam": {
      "provider": "steam",
      "baseUrl": "https://store.steampowered.com",
      "watch": {
        "kind": "game",
        "component": "valheim",
        "app": 896660,
        "os": "linux",
        "depots": ["896661"],
        "channels": {
          "public": {"branch": "public"},
          "public-test": {"branch": "public-test", "enabled": false}
        },
        "knownBranches": ["regex:^default_(old|pre[a-z0-9_]+)$"]
      }
    },
    "thunderstore": {
      "provider": "thunderstore",
      "baseUrl": "https://thunderstore.io",
      "watch": {
        "kind": "framework",
        "component": "valheim",
        "namespace": "denikson",
        "name": "BepInExPack_Valheim",
        "channels": {"latest": {"branch": "release"}}
      }
    }
  },
  "build": {"system": "script", "projectDir": "games/valheim"},
  "componentRoles": {
    "server-plugin": {
      "description": "Dedicated-server BepInEx plugin folder (BepInEx/plugins/TakaroValheim); the only half that holds the Takaro token",
      "artifactPattern": "takaro-valheim-plugin-{target}-{version}.zip"
    },
    "client-companion": {
      "description": "Graphical-client BepInEx companion (BepInEx/plugins/TakaroValheimCompanion); optional, never loaded by the dedicated server",
      "artifactPattern": "takaro-valheim-companion-{target}-{version}.zip"
    }
  },
  "legacyAssetAliases": {
    "takaro-valheim-plugin.zip": "linux-1.0.15/server-plugin",
    "takaro-valheim-companion.zip": "linux-1.0.15/client-companion"
  },
  "devServers": {"composeFile": "valheim.yml"}
}
