{
  "schemaVersion": 1,
  "id": "7d2d",
  "name": "7 Days to Die",
  "connector": "7d2d",
  "platforms": ["linux"],
  "sources": {
    "steam": {"provider": "steam", "baseUrl": "https://store.steampowered.com"}
  },
  "build": {"system": "script", "projectDir": "games/7d2d"},
  "componentRoles": {
    "server-mod": {
      "description": "Server-side Takaro mod folder (Mods/Takaro) loaded by the dedicated server",
      "artifactPattern": "takaro-7d2d-mod-{target}-{version}.zip"
    }
  },
  "legacyAssetAliases": {"takaro-7d2d-mod.zip": "linux-3.2.0.b10/server-mod"},
  "devServers": {"composeFile": "7d2d.yml"}
}
